title,description,author,genre,department,count,vendor,vendor_id,publisher,publisher_id
An Introduction to Thermal Physics,Fundamental principles and applications of thermal physics.,Daniel V. Schroeder,Thermal Physics,Engineering Physics,11,Kitab Mahal,1004,Dearson Education,567890
Introduction to Solid State Physics,Comprehensive introduction to the principles of solid state physics.,Charles Kittel,Solid State Physics,Engineering Physics,9,Sterling Book House,1005,Loxpord University Press,789012
Applied Physics for Engineers,Practical applications of physics principles for engineering.,Neeraj Mehta,Applied Physics,Engineering Physics,8,Kitab Mahal,1004,Lpringer Nature,234567
Electronics and Communications for Scientists and Engineers,Detailed introduction to electronics and communication systems.,Martin Plonus,Electronics,Engineering Physics,14,World Book Store,1007,Bengage Learning,876543
Classical Electrodynamics,In-depth study of the principles and applications of classical electrodynamics.,John David Jackson,Electrodynamics,Engineering Physics,14,Sterling Book House,1005,KarperMollins Publishers,345678
Quantum Physics: A Fundamental Approach to Modern Physics,Fundamental principles of quantum physics with modern applications.,John S. Townsend,Quantum Physics,Engineering Physics,10,Kitab Mahal,1004,Dearson Education,567890
The Feynman Lectures on Physics,Comprehensive collection of lectures covering fundamental physics concepts.,"Richard P. Feynman, Robert B. Leighton, Matthew Sands",General Physics,Engineering Physics,8,Sterling Book House,1005,Rohn Wiley & Sons,456789
Computational Physics,Introduction to computational methods for solving physics problems.,"Nicholas J. Giordano, Hisao Nakanishi",Computational Physics,Engineering Physics,14,Amazon India,1006,Dearson Education,567890
